<xsd:schema xmlns:xsd="http://www.w3.org/2001/XMLSchema" xmlns:tns="http://naaccr.org/naaccrfile" targetNamespace="http://naaccr.org/naaccrfile" >

<xsd:element name="NAACCRDataExchange">
	<xsd:complexType>
		<xsd:sequence>
			<xsd:element ref="tns:Dictionary" minOccurs="0" maxOccurs="1" />
			<xsd:element ref="tns:Patient" minOccurs="0" maxOccurs="unbounded" />
			<xsd:element ref="tns:CancerRecord" minOccurs="0" maxOccurs="unbounded" />
		</xsd:sequence>
		<xsd:attribute name="extractID" use="optional" />
		<xsd:attribute name="NAACCRVersion" use="required" />
		<xsd:attribute name="xsdVersion" use="optional" fixed="1.0" />
		<xsd:attribute name="datePrepared" use="required" type="xsd:dateTime" />
		<xsd:attribute name="sender" use="required" />
		<xsd:attribute name="senderCode" use="optional" />
		<xsd:attribute name="description" use="optional" />
		<xsd:attribute name="geography" use="optional" />
		<xsd:attribute name="dateFrom" use="optional" type="xsd:date" />
		<xsd:attribute name="dateTo" use="optional" type="xsd:date" />
	</xsd:complexType>
</xsd:element>

<xsd:element name="Patient">
	<xsd:complexType>
		<xsd:sequence>
			<xsd:element ref="tns:Item" minOccurs="0" maxOccurs="unbounded" />
			<xsd:any namespace="##other" processContents="lax" minOccurs="0" maxOccurs="unbounded" />
			<xsd:element ref="tns:Tumor" minOccurs="1" maxOccurs="unbounded" />
		</xsd:sequence>
	</xsd:complexType>
</xsd:element>

<xsd:element name="Tumor">
	<xsd:complexType>
		<xsd:sequence>
			<xsd:element ref="tns:Item" minOccurs="0" maxOccurs="unbounded" />
			<xsd:any namespace="##other" processContents="lax" minOccurs="0" maxOccurs="unbounded" />
		</xsd:sequence>
	</xsd:complexType>
</xsd:element>

<xsd:element name="CancerRecord">
	<xsd:complexType>
		<xsd:sequence>
			<xsd:element ref="tns:Item" minOccurs="0" maxOccurs="unbounded" />
			<xsd:any namespace="##other" processContents="lax" minOccurs="0" maxOccurs="unbounded" />
		</xsd:sequence>
		<xsd:attribute name="documentID" use="optional" type="xsd:string" />
		<xsd:attribute name="timeStamp" use="optional" type="xsd:dateTime" />
		<xsd:attribute name="isVoid" use="optional" type="xsd:boolean" default="false" />
		<xsd:attribute name="voidBy" use="optional" />
		<xsd:attribute name="voidDate" use="optional" type="xsd:date" />
		<xsd:attribute name="voidReason" use="optional" />
	</xsd:complexType>
</xsd:element>

<xsd:complexType name="itemType" >
	<xsd:simpleContent>
		<xsd:extension base="xsd:string" >
			<xsd:attribute name="itemNo" type="xsd:integer" use="optional" />
			<xsd:attribute name="itemName" use="optional" type="xsd:IDREF" />
			<xsd:attribute name="isDeprecated" use="optional" type="xsd:boolean" default="false" />
			<xsd:attribute name="isMissing" use="optional" type="xsd:boolean" default="false" />
		</xsd:extension>
	</xsd:simpleContent>
</xsd:complexType>

<xsd:element name="Item" type="tns:itemType" />

<xsd:element name="Dictionary">
	<xsd:complexType>
		<xsd:sequence>
			<xsd:element ref="tns:ItemDefs" />
		</xsd:sequence>
		<xsd:attribute name="dictionaryVersion" use="optional" />
		<xsd:attribute name="releaseDate" use="optional" />
		<xsd:attribute name="description" use="optional" />
	</xsd:complexType>
</xsd:element>

<xsd:element name="ItemDefs">
	<xsd:complexType>
		<xsd:sequence>
			<xsd:element ref="tns:ItemDef" minOccurs="0" maxOccurs="unbounded" />
		</xsd:sequence>
	</xsd:complexType>
</xsd:element>

<xsd:simpleType name="datatypeType">
	<xsd:restriction base="xsd:string">
		<xsd:enumeration value="code" />
		<xsd:enumeration value="codeWithBlank" />
		<xsd:enumeration value="alpha" />
		<xsd:enumeration value="alphaWithBlank" />
		<xsd:enumeration value="date" />
		<xsd:enumeration value="string" />
		<xsd:enumeration value="stringInitialBlankOK" />
		<xsd:enumeration value="integer" />
		<xsd:enumeration value="integerLeftZeroPad" />
	</xsd:restriction>
</xsd:simpleType>

<xsd:element name="ItemDef">
	<xsd:complexType>
		<xsd:sequence>
			<xsd:element ref="tns:ValidValue" minOccurs="0" maxOccurs="unbounded" />
		</xsd:sequence>
		<xsd:attribute name="itemName" use="required" type="xsd:ID" />
		<xsd:attribute name="itemNo" use="required" type="xsd:integer" />
		<xsd:attribute name="datatype" use="required" type="tns:datatypeType" />
		<xsd:attribute name="parentElement" use="required" type="xsd:string" />
		<xsd:attribute name="longName" use="optional" type="xsd:string" />
		<xsd:attribute name="section" use="optional" type="xsd:string" />
		<xsd:attribute name="fixedStart" use="optional" type="xsd:integer" />
		<xsd:attribute name="itemLength" use="optional" type="xsd:integer" />
		<xsd:attribute name="retiredVersion" use="optional" type="xsd:string" />
		<xsd:attribute name="sourceOfStandard" use="optional" type="xsd:string" />
		<xsd:attribute name="recordTypes" use="optional" type="xsd:string" />
		<xsd:attribute name="regex" use="optional" type="xsd:string" />
		<xsd:attribute name="shadow" use="optional" type="xsd:boolean" default="false" />
	</xsd:complexType>
</xsd:element>

<xsd:element name="ValidValue" >
	<xsd:complexType>
		<xsd:simpleContent>
			<xsd:extension base="xsd:string">
				<xsd:attribute name="code" use="required" type="xsd:string" />
				<xsd:attribute name="description" use="optional" />
				<xsd:attribute name="isMissing" use="optional" type="xsd:boolean" default="false" />
			</xsd:extension>	
		</xsd:simpleContent>
	</xsd:complexType>
</xsd:element>

</xsd:schema>
